{
  "schemaVersion": "archcontext.structurizr-mapping/v1",
  "id": "mapping.structurizr.native",
  "exportMode": "export-first",
  "native": {
    "nodeKinds": ["capability", "module", "component", "interface", "datastore", "external-system"],
    "relationKinds": ["depends-on", "calls", "publishes", "subscribes", "reads", "writes"]
  },
  "structurizr": {
    "workspace": "ArchContext",
    "model": ["softwareSystem", "container", "component"],
    "views": ["systemLandscape", "container", "component"]
  },
  "views": ["systemLandscape", "container"]
}
